{
    "workflow_id":  "biomedical-research-council.standard",
    "runtime":  "claude-code",
    "alias":  "biomedical-research-council",
    "mode":  "standard",
    "track":  "general-biomedical",
    "nodes":  [
                  {
                      "id":  "S0_context_lock",
                      "agent":  "protocol-context-locker",
                      "outputs":  [
                                      "runtime_capability_preflight",
                                      "workflow_run"
                                  ],
                      "blocking":  true
                  },
                  {
                      "id":  "S1_lead_route",
                      "agent":  "life-science-lead-scientist",
                      "requires":  [
                                       "S0_context_lock"
                                   ],
                      "outputs":  [
                                      "lead_decision"
                                  ],
                      "blocking":  true
                  },
                  {
                      "id":  "S2_source_lock",
                      "agent":  "life-science-literature-curator",
                      "requires":  [
                                       "S1_lead_route"
                                   ],
                      "outputs":  [
                                      "source_corpus"
                                  ],
                      "blocking":  true
                  },
                  {
                      "id":  "S3_claim_graph",
                      "agent":  "central-claim-ledger-evidence-graph",
                      "requires":  [
                                       "S2_source_lock"
                                   ],
                      "outputs":  [
                                      "claim_ledger"
                                  ],
                      "blocking":  true
                  },
                  {
                      "id":  "S4_review",
                      "agent":  "claim-level-evidence-verifier",
                      "requires":  [
                                       "S3_claim_graph"
                                   ],
                      "outputs":  [
                                      "results_integration"
                                  ],
                      "blocking":  true,
                      "spawnable":  true,
                      "independence_required":  true
                  },
                  {
                      "id":  "S5_write_validate",
                      "agent":  "post-write-final-validator",
                      "requires":  [
                                       "S4_review"
                                   ],
                      "outputs":  [
                                      "post_write_validation",
                                      "final_text"
                                  ],
                      "blocking":  true,
                      "spawnable":  true,
                      "independence_required":  true
                  }
              ],
    "release_gates":  [
                          "bmat_validate",
                          "bmat_tool_ledger_check"
                      ]
}
